{
  "intent_version": "1.0.0",
  "skill": "special-locations",
  "consumed_lighting_layout_intent": null,
  "special_locations_zoning": {
    "zones": [
      {
        "zone_id": "zone_elv_bollard_1_barrier",
        "zone_type": "elv_barrier_zone",
        "source_anchor_id": "elv_bollard_1",
        "derivation_clause": "BS 7671:2018 §715",
        "boundary_plan_polygon_mm": [
          [3500, 3000], [3433, 3250], [3250, 3433], [3000, 3500], [2750, 3433], [2567, 3250],
          [2500, 3000], [2567, 2750], [2750, 2567], [3000, 2500], [3250, 2567], [3433, 2750]
        ],
        "height_min_mm": 0,
        "height_max_mm": 1500,
        "ip_rating_min": "IPx4",
        "max_voltage_v": 12,
        "rcd_required_ma": null,
        "isolation_required": false,
        "allowed_equipment_classes": ["class_3_SELV"],
        "prohibited_fixture_types": ["socket_230v", "luminaire_lv_non_selv"],
        "switch_position_min_distance_mm": null,
        "overlapping_with_zone_ids": [],
        "_clause_citation": "BS 7671:2018 §715 + BS EN 61558-2-6 (no §715 sub-clauses in verified file)",
        "_derivation_note": "ELV barrier zone for bollard 1; 500mm radius, 12-sided polygon per spec §5.4 + §5.7. Architectural extraction provenance."
      },
      {
        "zone_id": "zone_elv_bollard_2_barrier",
        "zone_type": "elv_barrier_zone",
        "source_anchor_id": "elv_bollard_2",
        "derivation_clause": "BS 7671:2018 §715",
        "boundary_plan_polygon_mm": [
          [7500, 3000], [7433, 3250], [7250, 3433], [7000, 3500], [6750, 3433], [6567, 3250],
          [6500, 3000], [6567, 2750], [6750, 2567], [7000, 2500], [7250, 2567], [7433, 2750]
        ],
        "height_min_mm": 0,
        "height_max_mm": 1500,
        "ip_rating_min": "IPx4",
        "max_voltage_v": 12,
        "rcd_required_ma": null,
        "isolation_required": false,
        "allowed_equipment_classes": ["class_3_SELV"],
        "prohibited_fixture_types": ["socket_230v", "luminaire_lv_non_selv"],
        "switch_position_min_distance_mm": null,
        "overlapping_with_zone_ids": [],
        "_clause_citation": "BS 7671:2018 §715 + BS EN 61558-2-6 (no §715 sub-clauses in verified file)",
        "_derivation_note": "ELV barrier zone for bollard 2; 4m east of bollard 1; no overlap (sum-of-radii 1m < 4m separation)."
      },
      {
        "zone_id": "zone_elv_bollard_3_barrier",
        "zone_type": "elv_barrier_zone",
        "source_anchor_id": "elv_bollard_3",
        "derivation_clause": "BS 7671:2018 §715",
        "boundary_plan_polygon_mm": [
          [11500, 3000], [11433, 3250], [11250, 3433], [11000, 3500], [10750, 3433], [10567, 3250],
          [10500, 3000], [10567, 2750], [10750, 2567], [11000, 2500], [11250, 2567], [11433, 2750]
        ],
        "height_min_mm": 0,
        "height_max_mm": 1500,
        "ip_rating_min": "IPx4",
        "max_voltage_v": 12,
        "rcd_required_ma": null,
        "isolation_required": false,
        "allowed_equipment_classes": ["class_3_SELV"],
        "prohibited_fixture_types": ["socket_230v", "luminaire_lv_non_selv"],
        "switch_position_min_distance_mm": null,
        "overlapping_with_zone_ids": [],
        "_clause_citation": "BS 7671:2018 §715 + BS EN 61558-2-6 (no §715 sub-clauses in verified file)",
        "_derivation_note": "ELV barrier zone for bollard 3; 4m east of bollard 2; no overlap."
      },
      {
        "zone_id": "zone_elv_bollard_4_barrier",
        "zone_type": "elv_barrier_zone",
        "source_anchor_id": "elv_bollard_4",
        "derivation_clause": "BS 7671:2018 §715",
        "boundary_plan_polygon_mm": [
          [5500, 10000], [5433, 10250], [5250, 10433], [5000, 10500], [4750, 10433], [4567, 10250],
          [4500, 10000], [4567, 9750], [4750, 9567], [5000, 9500], [5250, 9567], [5433, 9750]
        ],
        "height_min_mm": 0,
        "height_max_mm": 1500,
        "ip_rating_min": "IPx4",
        "max_voltage_v": 12,
        "rcd_required_ma": null,
        "isolation_required": false,
        "allowed_equipment_classes": ["class_3_SELV"],
        "prohibited_fixture_types": ["socket_230v", "luminaire_lv_non_selv"],
        "switch_position_min_distance_mm": null,
        "overlapping_with_zone_ids": [],
        "_clause_citation": "BS 7671:2018 §715 + BS EN 61558-2-6 (no §715 sub-clauses in verified file)",
        "_derivation_note": "ELV barrier zone for bollard 4; north terrace; engineer_manual_entry provenance honestly disclosed."
      },
      {
        "zone_id": "zone_elv_bollard_5_barrier",
        "zone_type": "elv_barrier_zone",
        "source_anchor_id": "elv_bollard_5",
        "derivation_clause": "BS 7671:2018 §715",
        "boundary_plan_polygon_mm": [
          [10500, 10000], [10433, 10250], [10250, 10433], [10000, 10500], [9750, 10433], [9567, 10250],
          [9500, 10000], [9567, 9750], [9750, 9567], [10000, 9500], [10250, 9567], [10433, 9750]
        ],
        "height_min_mm": 0,
        "height_max_mm": 1500,
        "ip_rating_min": "IPx4",
        "max_voltage_v": 12,
        "rcd_required_ma": null,
        "isolation_required": false,
        "allowed_equipment_classes": ["class_3_SELV"],
        "prohibited_fixture_types": ["socket_230v", "luminaire_lv_non_selv"],
        "switch_position_min_distance_mm": null,
        "overlapping_with_zone_ids": [],
        "_clause_citation": "BS 7671:2018 §715 + BS EN 61558-2-6 (no §715 sub-clauses in verified file)",
        "_derivation_note": "ELV barrier zone for bollard 5; engineer_manual_entry provenance honestly disclosed."
      },
      {
        "zone_id": "zone_elv_bollard_6_barrier",
        "zone_type": "elv_barrier_zone",
        "source_anchor_id": "elv_bollard_6",
        "derivation_clause": "BS 7671:2018 §715",
        "boundary_plan_polygon_mm": [
          [15500, 7500], [15433, 7750], [15250, 7933], [15000, 8000], [14750, 7933], [14567, 7750],
          [14500, 7500], [14567, 7250], [14750, 7067], [15000, 7000], [15250, 7067], [15433, 7250]
        ],
        "height_min_mm": 0,
        "height_max_mm": 1500,
        "ip_rating_min": "IPx4",
        "max_voltage_v": 12,
        "rcd_required_ma": null,
        "isolation_required": false,
        "allowed_equipment_classes": ["class_3_SELV"],
        "prohibited_fixture_types": ["socket_230v", "luminaire_lv_non_selv"],
        "switch_position_min_distance_mm": null,
        "overlapping_with_zone_ids": [],
        "_clause_citation": "BS 7671:2018 §715 + BS EN 61558-2-6 (no §715 sub-clauses in verified file)",
        "_derivation_note": "ELV barrier zone for bollard 6; inferred_from_room_type provenance (weakest tier); engineer-of-record to verify."
      }
    ],
    "electrical_constraints": [
      {
        "constraint_type": "elv_separation",
        "applies_to_room_polygon": true,
        "applies_to_zone_ids": ["zone_elv_bollard_1_barrier", "zone_elv_bollard_2_barrier", "zone_elv_bollard_3_barrier", "zone_elv_bollard_4_barrier", "zone_elv_bollard_5_barrier", "zone_elv_bollard_6_barrier"],
        "_clause_citation": "BS 7671:2018 §715 + BS EN 61558-2-6 (no §715 sub-clauses in verified file)",
        "_derivation_note": "ELV / LV separation per §715 + BS EN 61558-2-6: ≥100mm cable spacing, physical barrier, label, transformer short-circuit protected.",
        "lv_cable_spacing_mm_min": 100,
        "barrier_required": true,
        "label_required": true,
        "transformer_short_circuit_protected": true,
        "_elv_general_citation": "BS 7671:2018 §715 + BS EN 61558-2-6 (no §715 sub-clauses in verified file)"
      }
    ],
    "compliant": true,
    "zone_count": 6,
    "constraint_count": 1,
    "violation_count_critical": 0,
    "violation_count_high": 0,
    "non_compliance_flags": [],
    "anchor_source_summary": {
      "all_extracted": false,
      "extraction_source_lowest": "inferred_from_room_type"
    }
  }
}
