{
  "intent_version": "1.0.0",
  "skill": "special-locations",
  "consumed_lighting_layout_intent": "electrical/lighting-layout/examples/ke-bathroom-cascade-source/intent-out.json",
  "special_locations_zoning": {
    "zones": [
      {
        "zone_id": "zone_bath_1_z0",
        "zone_type": "bath_zone_0",
        "source_anchor_id": "bath_1",
        "derivation_clause": "KS 1700:2018 §313 (route to BS 7671:2018+A2:2022 §701)",
        "boundary_plan_polygon_mm": [
          [
            500,
            0
          ],
          [
            2200,
            0
          ],
          [
            2200,
            700
          ],
          [
            500,
            700
          ]
        ],
        "height_min_mm": 0,
        "height_max_mm": 550,
        "ip_rating_min": "IPx7",
        "max_voltage_v": 12,
        "rcd_required_ma": 30,
        "isolation_required": true,
        "allowed_equipment_classes": [
          "class_3_SELV"
        ],
        "prohibited_fixture_types": [
          "socket_230v",
          "switch_230v",
          "luminaire_non_ip_rated",
          "shaver_socket",
          "fixed_heater_230v"
        ],
        "switch_position_min_distance_mm": null,
        "overlapping_with_zone_ids": [],
        "_clause_citation": "KS 1700:2018 §313 (route to BS 7671:2018+A2:2022 §701.414.4.5 (SELV ≤12 V in Zone 0) + §701.411.3.3 (30 mA RCD blanket))",
        "_derivation_note": "Zone 0 is the interior volume of the bath basin per BS 7671:2018 §701 zone-table convention. Bounded by the bath rim (~550mm AFF). SELV-only equipment permitted; no socket/switch/non-SELV fixtures. Polygon = bath_tray rectangular footprint (500-2200 × 0-700 mm)."
      },
      {
        "zone_id": "zone_bath_1_z1",
        "zone_type": "bath_zone_1",
        "source_anchor_id": "bath_1",
        "derivation_clause": "KS 1700:2018 §313 (route to BS 7671:2018+A2:2022 §701)",
        "boundary_plan_polygon_mm": [
          [
            500,
            0
          ],
          [
            2200,
            0
          ],
          [
            2200,
            700
          ],
          [
            500,
            700
          ]
        ],
        "height_min_mm": 550,
        "height_max_mm": 2250,
        "ip_rating_min": "IPx4",
        "max_voltage_v": 230,
        "rcd_required_ma": 30,
        "isolation_required": false,
        "allowed_equipment_classes": [
          "class_1",
          "class_2",
          "class_3_SELV"
        ],
        "prohibited_fixture_types": [
          "socket_230v",
          "switch_230v",
          "luminaire_non_ip_rated"
        ],
        "switch_position_min_distance_mm": null,
        "overlapping_with_zone_ids": [
          "zone_shower_1_z1"
        ],
        "_clause_citation": "KS 1700:2018 §313 (route to BS 7671:2018+A2:2022 §701 + §701.411.3.3 (30 mA RCD))",
        "_derivation_note": "Zone 1 is the vertical projection above the bath polygon, from rim level (550mm) to 2250mm AFF per §701 zone-table convention. IPx4 minimum; 230V class_1/2 permitted with RCD. Overlaps shower_1 zone_1 polygon — overlap recorded for INV-01 catalogue integrity."
      },
      {
        "zone_id": "zone_shower_1_z1",
        "zone_type": "bath_zone_1",
        "source_anchor_id": "shower_1",
        "derivation_clause": "KS 1700:2018 §313 (route to BS 7671:2018+A2:2022 §701)",
        "boundary_plan_polygon_mm": [
          [
            500,
            0
          ],
          [
            2200,
            0
          ],
          [
            2200,
            700
          ],
          [
            500,
            700
          ]
        ],
        "height_min_mm": 0,
        "height_max_mm": 2100,
        "ip_rating_min": "IPx4",
        "max_voltage_v": 230,
        "rcd_required_ma": 30,
        "isolation_required": false,
        "allowed_equipment_classes": [
          "class_1",
          "class_2",
          "class_3_SELV"
        ],
        "prohibited_fixture_types": [
          "socket_230v",
          "switch_230v",
          "luminaire_non_ip_rated"
        ],
        "switch_position_min_distance_mm": null,
        "overlapping_with_zone_ids": [
          "zone_bath_1_z1"
        ],
        "_clause_citation": "KS 1700:2018 §313 (route to BS 7671:2018+A2:2022 §701)",
        "_derivation_note": "Zone 1 from shower_1 head at 2100mm AFF: zone extends vertically from floor to shower-head height per §701 zone-table where shower head fixes Zone 1 ceiling. Coincides with bath polygon (shower-over-bath). Overlap with zone_bath_1_z1 declared per INV-01."
      },
      {
        "zone_id": "zone_bath_1_z2",
        "zone_type": "bath_zone_2",
        "source_anchor_id": "bath_1",
        "derivation_clause": "KS 1700:2018 §313 (route to BS 7671:2018+A2:2022 §701)",
        "boundary_plan_polygon_mm": [
          [
            -100,
            -600
          ],
          [
            2800,
            -600
          ],
          [
            2800,
            1300
          ],
          [
            -100,
            1300
          ]
        ],
        "height_min_mm": 0,
        "height_max_mm": 2250,
        "ip_rating_min": "IPx4",
        "max_voltage_v": 230,
        "rcd_required_ma": 30,
        "isolation_required": false,
        "allowed_equipment_classes": [
          "class_1",
          "class_2",
          "class_3_SELV"
        ],
        "prohibited_fixture_types": [
          "socket_230v"
        ],
        "switch_position_min_distance_mm": 3000,
        "overlapping_with_zone_ids": [
          "zone_shower_1_z2"
        ],
        "_clause_citation": "KS 1700:2018 §313 (route to BS 7671:2018+A2:2022 §701 + §701.512.3 (socket ≥3 m from Zone 1))",
        "_derivation_note": "Zone 2 = 600mm horizontal extension of Zone 1 polygon per §701 zone-table; unclipped polygon shown for derivation transparency. In practice clipped to room polygon (intersection with [0,0]-[2700,2100] is [0,0]-[2700,1300]). Socket outlets prohibited within 3m of Zone 1 per §701.512.3."
      },
      {
        "zone_id": "zone_shower_1_z2",
        "zone_type": "bath_zone_2",
        "source_anchor_id": "shower_1",
        "derivation_clause": "KS 1700:2018 §313 (route to BS 7671:2018+A2:2022 §701)",
        "boundary_plan_polygon_mm": [
          [
            -100,
            -600
          ],
          [
            2800,
            -600
          ],
          [
            2800,
            1300
          ],
          [
            -100,
            1300
          ]
        ],
        "height_min_mm": 0,
        "height_max_mm": 2100,
        "ip_rating_min": "IPx4",
        "max_voltage_v": 230,
        "rcd_required_ma": 30,
        "isolation_required": false,
        "allowed_equipment_classes": [
          "class_1",
          "class_2",
          "class_3_SELV"
        ],
        "prohibited_fixture_types": [
          "socket_230v"
        ],
        "switch_position_min_distance_mm": 3000,
        "overlapping_with_zone_ids": [
          "zone_bath_1_z2"
        ],
        "_clause_citation": "KS 1700:2018 §313 (route to BS 7671:2018+A2:2022 §701 + §701.512.3)",
        "_derivation_note": "Zone 2 from shower_1: 600mm horizontal extension of Zone 1; vertical ceiling tied to shower head (2100mm) per §701 zone-table. Polygon coincides with bath_1 zone_2 because shower-over-bath shares the wet area. Overlap with zone_bath_1_z2 declared per INV-01."
      }
    ],
    "electrical_constraints": [
      {
        "constraint_type": "rcd_blanket_by_room",
        "applies_to_room_polygon": true,
        "applies_to_zone_ids": null,
        "_clause_citation": "KS 1700:2018 §313 (route to BS 7671:2018+A2:2022 §701.411.3.3)",
        "_derivation_note": "30 mA RCD protection required for all low-voltage circuits serving locations containing a bath or shower per BS 7671:2018 §701.411.3.3. Heater exemption does not apply here — bathroom, not sauna.",
        "rcd_rating_ma": 30,
        "applies_to_circuit_types": [
          "lighting",
          "sockets",
          "shower_unit",
          "fixed_equipment",
          "shaver_socket"
        ],
        "sauna_heater_excluded": false
      }
    ],
    "compliant": true,
    "zone_count": 5,
    "constraint_count": 1,
    "violation_count_critical": 0,
    "violation_count_high": 0,
    "non_compliance_flags": [],
    "anchor_source_summary": {
      "all_extracted": true,
      "extraction_source_lowest": "architectural_drawing_extraction"
    }
  }
}